세부항목,규제내용,컴플라이언스,매핑ID,매핑여부(직접매핑/해당없음),감사가능,감사방법(AWS 콘솔/CLI),권장해결(요약)
제26조(고위험 인공지능 시스템 배포자의 의무),"26.5 사용설명서 기반 시스템 운용 모니터링, 위험 발생시 제공자·당국 통지 및 사용 중단, 중대사건 보고 의무",eu-ai-act,7.0-01;7.0-02;3.0-01,직접매핑,,,
제26조(고위험 인공지능 시스템 배포자의 의무),26.6 배포자 관리 범위 내 자동 생성 로그의 적절한 기간 또는 최소 6개월 보관 의무,eu-ai-act,3.0-11,직접매핑,,,
제43조(적합성평가),43.4 실질적 수정시 재평가,eu-ai-act,16.0-02;11.0-02,직접매핑,,,
제51조(범용 인공지능 모델의 시스템적 위험이 있는 범용 인공지능 모델로의 분류),51.2 고영향력 추정 기준(훈련에 사용되는 누적 계산량이 10보다 클 때),eu-ai-act,11.0-02;7.0-01,직접매핑,,,
제53조(범용 인공지능 모델 제공자의 의무),53.1 제공자의 4가지 의무,eu-ai-act,11.0-02;3.0-01;3.0-11;12.0-04,직접매핑,,,
제55조(시스템적 위험이 있는 범용 인공지능 모델 제공자의 의무),55.1 제공자의 4가지 추가 의무,eu-ai-act,7.0-01;3.0-11;11.0-02;2.0-01,직접매핑,,,
제59조(인공지능 규제 샌드박스에서 공익을 위한 특정 인공지능 시스템 개발을 위한 개인데이터의 추가 처리),59.1 공익 목적 개인데이터 처리 조건,eu-ai-act,3.0-01;11.0-02;1.0-01;2.0-01,직접매핑,,,
제60조(인공지능 규제 샌드박스 외부의 실제 조건에서 고위험 인공지능 시스템 시험),60.5 동의 철회 및 데이터 삭제,eu-ai-act,4.0-01;4.0-03;3.0-01,직접매핑,,,
제72조(제공자의 시판 후 모니터링 및 고위험 인공지능 시스템에 대한 시판 후 모니터링 계획),72.2 데이터 수집·분석 및 지속적 준수 평가,eu-ai-act,7.0-01;3.0-03;3.0-11,직접매핑,,,
제74조(유럽연합 시장에서 인공지능 시스템의 시장 감시 및 통제),74.12 문서·데이터 접근권,eu-ai-act,3.0-01;3.0-11,직접매핑,,,
제74조(유럽연합 시장에서 인공지능 시스템의 시장 감시 및 통제),74.13 소스코드 접근 조건,eu-ai-act,16.0-01;4.0-02;3.0-01,직접매핑,,,
제77조(기본권 보호 기관의 권한),77.1 문서 접근 권한,eu-ai-act,3.000001,직접매핑,,,
GOVERN 1.5,위험 관리 프로세스와 그 결과는 지속적으로 모니터링·정기 검토되어야 하며 역할·책임이 명확해야 함(검토 주기 포함),nist-ai-rmf,7.0-01;11.0-02;3.0-01;16.0-02,직접매핑,,,
GOVERN 1.6,"AI 시스템을 식별·목록화하고, 조직의 위험 우선순위에 따라 자원을 배분할 수 있는 메커니즘이 마련되어야 함",nist-ai-rmf,5.0-03;11.0-02;7.0-01,직접매핑,,,
GOVERN 1.7,"AI 시스템을 안전하게 서비스 종료(phase-out)하거나 해체(decommission)할 수 있는 절차와 프로세스가 마련되어야 하며, 이는 새로운 위험을 증가시키거나 신뢰성을 저하시켜서는 안됨",nist-ai-rmf,4.0-01;4.0-02;11.0-02;9.0-07,직접매핑,,,
GOVERN 4.2,조직 팀은 설계·개발·배포·운영하는 AI의 위험과 잠재적 영향을 문서화하고 폭넓게 공유해야 함,nist-ai-rmf,3.0-01;11.0-02;7.0-01,직접매핑,,,
MEASURE 1.1,"MAP 기능에서 나열된 AI 위험을 측정하기 위한 접근 방식과 지표가 선택되어야 하며, 가장 중요한 위험부터 시작해야 함. 측정할 수 없거나 측정하지 않는 위험은 적절히 문서화되어야 함.",nist-ai-rmf,7.0-01;3.0-01;11.0-02,직접매핑,,,
MEASURE 1.2,AI 지표의 적절성과 기존 통제의 효과성은 오류 보고 및 영향을 받는 공동체에 대한 영향 평가를 포함하여 정기적으로 평가·갱신된다.,nist-ai-rmf,7.0-01;7.0-02;11.0-02,직접매핑,,,
MEASURE 2.2,"사람을 대상으로 하는 평가가 있을 경우, 관련 요구사항(인간 대상 보호 포함)을 충족하고 관련 모집단을 대표해야 한다.",nist-ai-rmf,11.0-02;5.0-01;5.0-02,직접매핑,,,
MEASURE 2.3,"AI 시스템 성능이나 보증 기준은 정성적·정량적으로 측정·시연되어야 함. 배포 조건과 유사한 환경에서 검증되어야 하며, 결과가 문서화되어야 함",nist-ai-rmf,16.0-02;7.0-01;3.0-01,직접매핑,,,
MEASURE 2.4,MAP 기능에서 확인된 AI 시스템 및 구성요소의 기능과 동작은 운영 환경에서 모니터링되어야 함,nist-ai-rmf,7.0-02;3.0-11,직접매핑,,,
MEASURE 2.5,배포될 AI 시스템은 유효하고 신뢰할 수 있음이 입증되어야 함. 기술이 개발된 조건을 넘어서는 일반화의 한계는 문서화되어야 함,nist-ai-rmf,16.0-02;3.0-01,직접매핑,,,
MEASURE 2.6,"MAP 기능에서 확인된 안전 위험에 대해 AI 시스템은 정기적으로 평가되어야 함. 배포될 시스템은 안전성이 입증되어야 하고, 잔여 위험은 위험 허용 수준을 넘지 않아야 하며, 특히 지식 한계를 벗어나 작동할 경우 안전하게 실패할 수 있어야 함. 안전 지표에는 신뢰성·강건성, 실시간 모니터링, AI 시스템 실패 대응 시간이 반영되어야 함",nist-ai-rmf,7.0-01;7.0-02;9.0-01;9.0-02;9.0-03,직접매핑,,,
MEASURE 2.8,MAP 기능에서 확인된 투명성과 책임성과 관련된 위험이 검토·문서화되어야 함,nist-ai-rmf,3.0-01;11.0-02,직접매핑,,,
MEASURE 2.10,MAP 기능에서 확인된 AI 시스템의 프라이버시 위험이 검토·문서화되어야 함,nist-ai-rmf,11.0-03;2.0-01;2.0-15,직접매핑,,,
MEASURE 2.11,MAP 기능에서 확인된 공정성과 편향이 평가되고 결과가 문서화되어야 함,nist-ai-rmf,5.0-01;5.0-02;11.0-02,직접매핑,,,
MEASURE 2.13,사용된 TEVV 지표와 프로세스의 효과성이 평가·문서화되어야 함,nist-ai-rmf,7.0-01;3.0-01,직접매핑,,,
MEASURE 4.3,관련 AI 행위자(영향을 받는 커뮤니티 포함)와의 협의 및 현장 데이터에 기반해 맥락 관련 위험과 신뢰성 특성에서 측정 가능한 성능 향상이나 저하가 식별되고 문서화되어야 함,nist-ai-rmf,11.0-02;3.0-01;7.0-01,직접매핑,,,
MANAGE 2.4,"의도된 사용과 일치하지 않는 성능이나 결과를 보이는 AI 시스템을 대체·분리·비활성화하기 위한 메커니즘이 마련·적용되어야 하며, 역할과 책임도 할당·이해되어야 함",nist-ai-rmf,7.0-03;9.0-01;9.0-02;11.0-02,직접매핑,,,
MANAGE 3.2,개발에 사용되는 사전 학습된 모델은 AI 시스템의 정기적 모니터링 및 유지 관리의 일부로 모니터링되어야 함,nist-ai-rmf,7.0-02;3.0-11;16.0-02,직접매핑,,,
MANAGE 4.1,"배포 이후 AI 시스템 모니터링 계획이 실행되어야 하며, 여기에는 사용자 및 관련 AI 행위자로부터 입력을 수집·평가하는 메커니즘, 이의 제기 및 무효화, 시스템 폐기, 사고 대응, 복구, 변경 관리가 포함되어야 함",nist-ai-rmf,7.0-01;7.0-02;9.0-01;9.0-03;16.0-02;4.0-01,직접매핑,,,
MANAGE 4.2,"지속적 개선을 위한 측정 가능한 활동은 AI 시스템 업데이트에 통합되어야 하며, 관련 AI 행위자를 포함한 이해관계자와의 정기적 협력을 포함해야 함",nist-ai-rmf,7.0-01;11.0-02;16.0-02,직접매핑,,,
8.1 운영 기획 및 통제,요구사항 충족 및 6장의 조치를 실행하기 위한 프로세스를 기획·구현·통제해야 한다.,iso-42001,11.0-02;7.0-01;16.0-02;3.0-01,직접매핑,,,
8.2 AI 위험 평가,계획된 간격 또는 주요 변경 시 위험 평가를 수행해야 한다.,iso-42001,7.0-01;11.0-02;16.0-02,직접매핑,,,
8.3 AI 위험 처리,위험 처리 계획을 실행·검증하고 필요시 재검토해야 한다.,iso-42001,7.0-01;16.0-02;3.0-01,직접매핑,,,
8.4 AI 시스템 영향 평가,계획된 간격 또는 주요 변경 시 영향 평가를 수행해야 한다.,iso-42001,11.0-03;7.0-01;16.0-02,직접매핑,,,
10.1 지속적 개선,적합성·충분성·효과성을 지속 개선해야 한다.,iso-42001,7.0-01;11.0-02;3.0-01,직접매핑,,,
10.2 부적합 및 시정조치,부적합 발생 시 대응·원인 분석·시정조치·효과 검토를 수행해야 한다.,iso-42001,7.0-03;9.0-03;3.0-01,직접매핑,,,
A.4.3 데이터 자원,AI 데이터 자원을 문서화해야 한다.,iso-42001,5.0-03;5.0-04;3.0-01,직접매핑,,,
A.6.2.8 이벤트 로그 기록,AI 시스템 운영 시 최소한 이벤트 로그를 기록해야 한다.,iso-42001,3.0-01;3.0-04;3.0-08,직접매핑,,,
A.7.5 데이터 출처,데이터 출처를 기록해야 한다.,iso-42001,5.0-03;5.0-04;3.0-01,직접매핑,,,
7.5.3 문서화된 정보의 관리,"ISMS 및 본 문서가 요구하는 문서화된 정보는 사용 시 적합성과 가용성을 보장하고, 손실·부적절 사용·무결성 손실로부터 보호되어야 한다. 조직은 배포·접근·검색·사용, 보관 및 가독성 유지, 변경 관리(버전 관리), 보존 및 폐기 등을 수행해야 한다. 외부 문서도 필요한 경우 식별·관리해야 한다.",iso-27001,3.0-01;4.0-01;4.0-02;4.0-04;16.0-02,직접매핑,,,
7.5.3 문서화된 정보의 관리,※ 접근은 단순 열람 권한부터 수정 권한까지 포함될 수 있다.,iso-27001,1.0-01;1.0-02;11.0-02,직접매핑,,,
8.2 정보보안 위험 평가,"조직은 계획된 간격마다 또는 중대한 변경이 제안·발생할 때 정보보안 위험 평가를 수행해야 하며, 6.1.2에서 설정된 기준을 고려해야 한다. 결과는 문서화된 정보로 유지해야 한다.",iso-27001,7.0-01;11.0-02;16.0-02,직접매핑,,,
8.3 정보보안 위험 처리,"조직은 정보보안 위험 처리 계획을 이행해야 하며, 결과를 문서화된 정보로 유지해야 한다.",iso-27001,7.0-01;16.0-02;3.0-01,직접매핑,,,
10.1 지속적 개선,조직은 ISMS의 적합성·충분성·효과성을 지속적으로 개선해야 한다.,iso-27001,7.0-01;11.0-02;3.0-01,직접매핑,,,
10.2 부적합 및 시정조치,"부적합 발생 시 조직은: a) 부적합에 대응(통제·수정, 결과 처리), b) 원인 제거 조치 필요성 평가(부적합 검토, 원인 규명, 유사 사례 확인), c) 필요한 조치 시행, d) 조치 효과 검토, e) 필요 시 ISMS 변경. 시정조치는 부적합 영향에 적절해야 한다. 부적합 및 후속 조치, 시정조치 결과는 문서화된 정보로 유지해야 한다.",iso-27001,7.0-03;9.0-03;3.0-01;16.0-02,직접매핑,,,
5.9 정보 및 관련 자산 목록,소유자 포함 정보 및 관련 자산의 목록을 개발·유지해야 한다.,iso-27001,5.0-03;5.0-04;11.0-01;3.0-01,직접매핑,,,
5.12 정보 분류,"정보는 기밀성, 무결성, 가용성 및 이해관계자 요구를 기반으로 분류되어야 한다.",iso-27001,12.0-05;11.0-03;8.0-03,직접매핑,,,
5.13 정보 라벨링,조직이 채택한 정보 분류 체계에 따라 적절한 정보 라벨링 절차를 개발·이행해야 한다.,iso-27001,12.0-05;11.0-03,직접매핑,,,
5.14 정보 전송,조직 내부 및 외부와의 모든 정보 전송에 대해 규칙·절차·계약을 마련해야 한다.,iso-27001,12.0-01;12.0-02;12.0-04;12.0-05,직접매핑,,,
5.15 접근 통제,비즈니스 및 정보보안 요구에 따라 물리적·논리적 접근 통제 규칙을 수립·이행해야 한다.,iso-27001,8.0-03;8.0-07;1.0-01,직접매핑,,,
5.18 접근 권한,"정보 및 관련 자산에 대한 접근 권한은 조직의 정책·규칙에 따라 부여, 검토, 변경 및 제거되어야 한다.",iso-27001,1.0-01;1.0-02;1.0-03,직접매핑,,,
5.23 클라우드 서비스 이용 시 정보보안,클라우드 서비스 획득·이용·관리·종료에 대한 프로세스를 조직의 정보보안 요구에 따라 수립해야 한다.,iso-27001,11.0-02;16.0-04;7.0-01,직접매핑,,,
5.33 기록 보호,기록은 손실·파괴·위조·무단 접근·무단 공개로부터 보호되어야 한다.,iso-27001,3.0-04;3.0-08;2.0-15;1.0-01,직접매핑,,,
5.34 개인정보 및 PII 보호,조직은 개인정보 및 PII 보호와 관련된 법규·계약 요구를 식별하고 이를 충족해야 한다.,iso-27001,11.0-03;12.0-05;4.0-01;3.0-11,직접매핑,,,
8.2 특권 접근 권한,특권 접근 권한의 할당·사용은 제한·관리되어야 한다.,iso-27001,1.0-01;1.0-06;8.0-03,직접매핑,,,
8.4 소스코드 접근,"소스코드, 개발 도구, 소프트웨어 라이브러리에 대한 접근은 적절히 관리되어야 한다.",iso-27001,16.0-01;10.0-01;8.0-03,직접매핑,,,
8.10 정보 삭제,불필요해진 정보는 시스템·장비·매체에서 삭제되어야 한다.,iso-27001,4.0-03;9.0-07;12.0-05,직접매핑,,,
8.11 데이터 마스킹,데이터 마스킹은 정책·요건·법규에 따라 사용되어야 한다.,iso-27001,12.0-05;11.0-03,직접매핑,,,
8.12 데이터 유출 방지,민감 정보를 처리·저장·전송하는 시스템·네트워크·장치에는 유출 방지 조치를 적용해야 한다.,iso-27001,12.0-05;8.0-03;8.0-05;7.0-02,직접매핑,,,
8.15 로깅,활동·예외·오류·이벤트를 기록하는 로그는 생성·저장·보호·분석되어야 한다.,iso-27001,3.0-01;3.0-04;3.0-08;7.0-02,직접매핑,,,
8.16 모니터링,네트워크·시스템·애플리케이션은 이상 행위를 모니터링하고 잠재적 사고를 평가하기 위한 적절한 조치를 취해야 한다.,iso-27001,7.0-02;7.0-04;3.0-11,직접매핑,,,
8.20 네트워크 보안,네트워크 및 장치는 정보 보호를 위해 보안·관리·통제되어야 한다.,iso-27001,8.0-01;8.0-05;8.0-07,직접매핑,,,
8.21 네트워크 서비스 보안,네트워크 서비스의 보안 메커니즘·서비스 수준·요구사항은 식별·이행·모니터링되어야 한다.,iso-27001,8.0-05;11.0-02;7.0-01,직접매핑,,,
8.24 암호화 사용,암호화 및 키 관리 사용 규칙은 정의·이행되어야 한다.,iso-27001,2.0-01;2.0-16;10.0-04,직접매핑,,,
8.31 개발·테스트·운영 환경 분리,"개발, 테스트, 운영 환경은 분리·보호되어야 한다.",iso-27001,11.0-01;11.0-02;8.0-03,직접매핑,,,
8.33 테스트 정보,테스트 정보는 적절히 선택·보호·관리되어야 한다.,iso-27001,11.0-03;4.0-05;12.0-05,직접매핑,,,
8.1.1 자산 목록,"정보 및 정보 처리 시설과 관련된 자산을 식별하고, 해당 자산의 목록을 작성하여 관리해야 한다.",iso-27017,5.0-03;5.0-04;11.0-01;3.0-01,직접매핑,,,
8.2.2 정보 라벨링,조직이 채택한 정보 분류 체계에 따라 정보 라벨링 절차를 수립하고 이행해야 한다.,iso-27017,12.0-05;11.0-03,직접매핑,,,
9.1.2 네트워크 및 네트워크 서비스 접근,사용자는 명시적으로 승인된 경우에만 네트워크 및 네트워크 서비스에 접근할 수 있어야 한다.,iso-27017,8.0-01;8.0-05;8.0-07,직접매핑,,,
9.2.4 사용자 비밀 인증정보 관리,비밀 인증정보의 할당은 공식적인 관리 프로세스를 통해 통제되어야 한다.,iso-27017,1.0-04;10.0-01;1.0-06,직접매핑,,,
9.4.1 정보 접근 제한,정보와 애플리케이션 시스템 기능에 대한 접근은 접근 통제 정책에 따라 제한되어야 한다.,iso-27017,8.0-03;11.0-02;1.0-01,직접매핑,,,
10.1.1 암호화 통제 사용 정책,정보 보호를 위한 암호화 통제 사용 정책을 수립하고 이행해야 한다.,iso-27017,2.0-01;2.0-15,직접매핑,,,
10.1.2 키 관리,"암호화 키의 사용, 보호 및 수명 주기 전반에 대한 정책을 수립하고 이행해야 한다.",iso-27017,2.0-16;10.0-04,직접매핑,,,
11.2.7 장비의 안전한 폐기 또는 재사용,저장 매체가 포함된 모든 장비는 폐기 또는 재사용 전에 민감 데이터 및 라이선스 소프트웨어가 제거되었거나 안전하게 덮어쓰기 되었음을 확인해야 한다.,iso-27017,4.0-03;9.0-07,직접매핑,,,
12.1.2 변경 관리,"조직, 비즈니스 프로세스, 정보 처리 시설 및 시스템에 대한 변경은 정보 보안에 영향을 미치므로 통제되어야 한다.",iso-27017,16.0-02;11.0-02;7.0-01,직접매핑,,,
12.3.1 정보 백업,"합의된 백업 정책에 따라 정보, 소프트웨어 및 시스템 이미지의 백업 사본을 정기적으로 생성하고 테스트해야 한다.",iso-27017,9.0-04;4.0-04,직접매핑,,,
12.4.1 이벤트 로깅,"사용자 활동, 예외, 오류 및 정보 보안 이벤트를 기록하는 이벤트 로그는 생성, 보관 및 정기적으로 검토되어야 한다.",iso-27017,3.0-01;3.0-04;7.0-02,직접매핑,,,
12.4.3 관리자 및 운영자 로그,"시스템 관리자 및 운영자의 활동은 기록되고, 로그는 보호 및 정기적으로 검토되어야 한다.",iso-27017,3.0-01;3.0-04;3.0-08,직접매핑,,,
13.1.3 네트워크 분리,"정보 서비스, 사용자 및 정보 시스템 그룹은 네트워크 상에서 분리되어야 한다.",iso-27017,8.0-07;8.0-05;11.0-01,직접매핑,,,
16.1.7 증거 수집,"증거로 활용될 수 있는 정보의 식별, 수집, 확보 및 보존을 위한 절차를 정의하고 적용해야 한다.",iso-27017,7.0-02;7.0-04;3.0-08,직접매핑,,,
18.1.3 기록 보호,"기록은 손실, 파괴, 위조, 무단 접근 및 무단 공개로부터 보호되어야 하며, 법규·규제·계약 및 비즈니스 요건을 준수해야 한다.",iso-27017,3.0-04;1.0-01;2.0-15;4.0-04,직접매핑,,,
18.1.5 암호화 통제 규제,"암호화 통제는 모든 관련 계약, 법규 및 규제를 준수하여 사용되어야 한다.",iso-27017,2.0-01;2.0-16;11.0-02,직접매핑,,,
CLD.8.1.5 클라우드 서비스 고객 자산 제거,"클라우드 서비스 제공자의 시설에 있는 클라우드 고객의 자산은 서비스 종료 시 신속히 제거되고, 필요한 경우 반환되어야 한다.",iso-27017,11.0-02;4.0-04;4.0-03,직접매핑,,,
CLD.9.5.1 가상 컴퓨팅 환경 분리,클라우드 서비스 고객의 가상 환경은 다른 클라우드 고객 및 무단 사용자로부터 보호되어야 한다.,iso-27017,8.0-01;8.0-05;8.0-07,직접매핑,,,
CLD.12.4.5 클라우드 서비스 모니터링,클라우드 서비스 고객은 자신이 사용하는 클라우드 서비스 운영의 특정 측면을 모니터링할 수 있는 기능을 보유해야 한다.,iso-27017,7.0-02;3.0-11;7.0-01,직접매핑,,,
CLD.13.1.4 가상 및 물리 네트워크 보안 관리 정합성,"가상 네트워크 구성 시, 가상 및 물리 네트워크 간 구성의 일관성은 클라우드 서비스 제공자의 네트워크 보안 정책에 기반해 검증되어야 한다.",iso-27017,8.0-05;11.0-02;7.0-01,직접매핑,,,
5.4.1.2 (6.1.2) 정보보호 위험 평가,"조직은 개인정보보호 관리체계의 범위 내에서 기밀성, 무결성 및 가용성 손실과 관련된 위험을 식별하기 위해 정보보호 위험 평가 프로세스를 적용해야 함. 또한 개인정보보호 관리체계 범위 내에서 개인식별정보(PII) 처리와 관련된 위험을 식별하기 위해 프라이버시 위험 평가 프로세스를 적용해야 함. 조직은 위험 평가 과정 전반에서 정보보호와 PII 보호 간의 관계가 적절히 관리되도록 보장해야 함. ※ 조직은 통합된 정보보호·프라이버시 위험 평가 프로세스를 적용할 수도 있고, 별도의 프로세스를 각각 적용할 수도 있음. 조직은 ISO/IEC 27001:2013, 6.1.2 c)에서 정의된 위험이 실제로 발생할 경우 조직과 PII 주체 모두에게 미칠 잠재적 결과를 평가해야 함.",iso-27701,7.0-01;6.0-04;11.0-02;5.0-02,직접매핑,,,
6.5.2.1 정보 분류,"조직의 정보 분류 체계는 반드시 PII(개인식별정보)를 명시적으로 포함해야 함. PII를 전체 분류 체계 안에서 고려하는 것은, 조직이 처리하는 PII의 종류와 특수 범주, 해당 PII가 어디에 저장되어 있는지, 그리고 어떤 시스템을 통해 흐르는지를 이해하는 데 핵심적임.",iso-27701,12.0-05;11.0-03;5.0-03;5.0-04,직접매핑,,,
6.6.2.1 사용자 등록 및 해지,"PII를 처리하는 시스템과 서비스를 관리·운영하는 사용자의 등록 및 해지 절차에는, 비밀번호 손상·유출이나 사용자 등록 데이터의 손상·노출로 인해 사용자 접근통제가 침해되는 상황을 포함해야 함. 조직은 PII를 처리하는 시스템과 서비스에 대해 비활성화되거나 만료된 사용자 ID를 다시 발급해서는 안됨. 조직이 PII 처리 서비스를 제공하는 경우, 사용자 ID 관리의 일부 또는 전부는 고객이 책임질 수 있으며, 이러한 경우 반드시 문서화된 정보에 포함해야 함. 또한 일부 관할권에서는 PII 처리 시스템과 관련된 미사용 인증 자격 증명의 점검 주기를 명시적으로 요구함. 해당 지역에서 운영하는 조직은 이러한 요구사항을 반드시 준수해야 함.",iso-27701,1.0-01;1.0-02;1.0-04;3.0-01,직접매핑,,,
6.6.2.2 사용자 접근 권한 부여,"조직은 정보시스템과 그 안에 포함된 PII에 접근 권한이 부여된 사용자에 대해, 정확하고 최신의 사용자 프로필 기록을 유지해야 함. 이 프로필에는 사용자 ID를 포함하여, 승인된 접근을 보장하기 위해 필요한 기술적 통제를 구현하는 데 필요한 데이터가 포함됨. 개별 사용자 접근 ID를 구현하면, 적절히 구성된 시스템이 누가 PII에 접근했는지, 그리고 추가·삭제·변경을 어떤 작업을 했는지 식별할 수 있음. 이것은 조직을 보호할 뿐만 아니라, 사용자가 자신이 처리한 것과 처리하지 않은 것을 구분할 수 있게 해 사용자를 보호함. 조직이 PII 처리 서비스를 제공하는 경우, 고객이 접근 관리의 일부 또는 전부를 책임질 수 있음. 이 경우 조직은 고객에게 접근 관리 수행 수단(예: 접근 관리·종료 권한을 제공하는 관리자 권한)을 제공해야 하며, 이러한 사항은 반드시 문서화해야 함.",iso-27701,1.0-01;11.0-02;13.0-02;3.0-11,직접매핑,,,
6.7.1.1 암호화 통제 사용에 관한 정책,"일부 관할 지역에서는 건강정보, 주민등록번호, 여권번호, 운전면허번호 등 특정 유형의 PII를 보호하기 위해 암호화 사용을 의무화할 수 있음. 조직은 자신이 처리하는 PII를 보호하기 위해 어떤 상황에서 암호화를 사용하는지 고객에게 정보를 제공해야 함. 또한 고객이 자체적으로 암호화 보호를 적용할 수 있도록 지원하는 기능이 있을 경우, 이에 대한 정보도 고객에게 제공해야 함.",iso-27701,2.0-01;2.0-15;12.0-05,직접매핑,,,
6.8.2.7 장비의 안전한 폐기 또는 재사용,"조직은 저장 공간이 재할당될 때, 그 저장 공간에 이전에 존재하던 PII가 접근되지 않도록 보장해야 함. 정보시스템에 저장된 PII를 삭제할 때, 성능 문제로 인해 해당 PII를 명시적으로 완전히 삭제하는 것이 비현실적인 경우가 있을 수 있음. 이 경우, 다른 사용자가 해당 PII에 접근할 수 있는 위험이 발생하며, 이를 방지하기 위해 특정 기술적 조치가 필요함. 또한 보안 폐기나 재사용을 위해, PII를 포함할 수 있는 저장 매체가 있는 장비는 실제로 PII가 포함되어 있는 것처럼 취급해야 함.",iso-27701,4.0-03;9.0-07;2.0-15,직접매핑,,,
6.9.4.1 이벤트 로깅,"조직은 이벤트 로그를 검토하는 프로세스를 마련해야 하며, 이는 지속적이고 자동화된 모니터링·알림 시스템을 통해 수행하거나, 그렇지 못할 경우 문서화된 주기에 따라 수동으로 검토해야 함. 목적은 이상 행위 식별 및 대응 방안 제안임. 가능하다면 이벤트 로그에는 PII 접근이 기록되어야 하며, 다음이 포함되어야 함: - 누가(by whom) - 언제(when) - 어떤 정보주체(PII principal)의 PII에 접근했는지 - 어떤 변화(추가, 수정, 삭제)가 있었는지 여러 서비스 제공자가 관련 서비스 제공에 관여하는 경우, 이 지침을 이행하는 역할이 다양하거나 공유될 수 있으며, 이 역할은 문서화되고, 로그 접근에 관한 합의도 포함되어야 함. PII processor에 대한 구현 가이드: - 로그 정보를 고객에게 언제, 어떻게 제공할지에 대한 기준을 정의하고 고객에게 제공해야 함. - 조직이 고객에게 로그 접근 권한을 허용하는 경우, 고객은 자신의 활동 관련 로그만 접근 가능해야 함. - 다른 고객의 로그에 접근하거나 로그를 수정할 수 없어야 함.",iso-27701,3.0-01;3.0-04;3.0-11;7.0-02,직접매핑,,,
6.9.4.2 로그 정보 보호,"보안 모니터링 및 운영 진단 등을 위해 기록되는 로그 정보에는 PII(개인식별정보)가 포함될 수 있음. 따라서 로그 정보가 의도된 목적 외에는 사용되지 않도록 접근통제(ISO/IEC 27002:2013, 9.2.3 참조) 같은 조치를 마련해야 함. 또한 로그 정보는 보존 일정에 따라 삭제 또는 비식별화되도록, 가능하다면 자동화된 절차를 마련해야 함.",iso-27701,3.0-04;12.0-05;4.0-04;1.0-01,직접매핑,,,
6.11.1.2 공용 네트워크에서의 애플리케이션 서비스 보호,"조직은 신뢰할 수 없는 데이터 전송 네트워크를 통해 PII(개인식별정보)가 전송될 경우, 반드시 암호화된 상태로 전송되도록 보장해야 함. 신뢰할 수 없는 네트워크에는 공용 인터넷이나 조직의 운영 통제 범위 밖에 있는 기타 네트워크가 포함됨.",iso-27701,2.0-09;8.0-03;12.0-05,직접매핑,,,
